{
  "schema_version": "zerostack.derivation-provenance.v1",
  "record_type": "derivation-provenance",
  "row_id": "cccccccccccccccccccccccccccccccccccccccccccccccccccccccccccccccc",
  "derived_kind": "outline_span",
  "derived_ref": "gz://blob/dddddddddddddddddddddddddddddddddddddddddddddddddddddddddddddddd#B0-64",
  "source_blob_digest": "dddddddddddddddddddddddddddddddddddddddddddddddddddddddddddddddd",
  "byte_span": { "start": 0, "end": 64 },
  "producing_engine": "graphzero",
  "producing_commit": "cafebabecafebabecafebabecafebabecafebabe",
  "transform_id": "graphzero.outline.extract_spans.v1",
  "created_at": "2026-07-16T20:05:00Z"
}
