{
  "schema_version": "zerostack.derivation-provenance.v1",
  "record_type": "derivation-provenance",
  "row_id": "aaaaaaaaaaaaaaaaaaaaaaaaaaaaaaaaaaaaaaaaaaaaaaaaaaaaaaaaaaaaaaaa",
  "derived_kind": "graph_edge",
  "derived_ref": "gz://blob/bbbbbbbbbbbbbbbbbbbbbbbbbbbbbbbbbbbbbbbbbbbbbbbbbbbbbbbbbbbbbbbb#B10-20",
  "source_blob_digest": "bbbbbbbbbbbbbbbbbbbbbbbbbbbbbbbbbbbbbbbbbbbbbbbbbbbbbbbbbbbbbbbb",
  "byte_span": { "start": 10, "end": 20 },
  "line_span": { "start": 2, "end": 2 },
  "producing_engine": "graphzero",
  "producing_commit": "deadbeefdeadbeefdeadbeefdeadbeefdeadbeef",
  "transform_id": "graphzero.overlay.extract_edges.v1",
  "created_at": "2026-07-16T20:00:00Z",
  "edge_src": "foo",
  "edge_dst": "bar",
  "edge_kind": 1
}
